Category,Review
chinese,"Golden Imperial Palace, a place that left me stuffed and happy. One morning, we decided to come here to try the dim sum. Walking into the restaurant, it was..."
chinese,Two reviews in a year I know but it's always a delight to have NDD on a Saturday night. They offer delivery a little bit later than the rest of the EV...
chinese,The workers are so sweet and the delivery is super quick. They make the best scallion pancakes I've ever had.
chinese,"It is difficult to find good Chinese food in downtown New York, especially for those of us too far from china town for delivery. I yelped this place and saw..."
chinese,"My husband and I were craving some soup dumplings, and we came across Great Sichuan on Seamless. We ordered the pork soup dumplings, sesame shrimp, and..."
chinese,"Very home style authentic Chinese food.
Fast delivery."
chinese,The delivery was fast and on time and the food was hot and delicious. I appreciate them delivering during the pandemic and would recommend to others.
chinese,"Not only is the food extremely good, but the friendly neighborhood feeling from this restaurant is what keeps me coming back. They recommend their..."
chinese,For a sesame shrimp and it wasn't that hood but everything else was. I had cheese wontons and an egg roll. But I'm surprised that the sesame shrimp was awful
chinese,"Just picked up yesterday. Great food! This will be my go-to Chinese spot now. 
I ordered the sweet and sour chicken combo platter with lomein and my husband..."
chinese,Best Chinese food in Brooklyn and the fact that I don't have to go pick up since they now deliver is a wonderful plus!!!
chinese,They've really improved upon opening! They are now my go to Chinese food and I'm loving the family deal that they have going on! So friendly and so cautious...
chinese,Since I was in sheepshead bay I placed an order for pickup....figuring ...how bad could it be since I go to Chopstix in Bay Ridge which is always delicious....
chinese,"I LOVE this place. I've ordered the following things, for pickup or delivery, and always been so happy.

Ma Po Tofu: Big portion, flavorful broth, love..."
chinese,"Take out service is quick, attentive, hot... And The food delicious... we had the broccoli with chicken, steamed chicken with rice,... And a noodle dish......"
chinese,"This is mislabeled, the place is called red hot 2 (there is no red hot one, get over it). I have lived in Manhattan and Brooklyn my hole life, this is the..."
chinese,"The dim sum here is delicious!  It totally reminds me of the meals I had on trips to Hong Kong in my childhood.  

My favorites were the har gao (shrimp..."
chinese,"When you're craving some banquet-style asian food on chinese new year, this is the spot to go. 

It's a huge, expansive, restaurant with the capability to..."
chinese,"9:45AM to 12:30PM is prime dim sum hours so avoid the times in between, otherwise you'll be looking at about an hour wait for a bigger party (5-7..."
chinese,"I usually agree with the ratings of the Yelp community, but I'm not sure why this restaurant gets such low reviews. I've been to Golden Unicorn and Jing..."
chinese,"We came here for dim sum on a Sunday morning. Service was pleasant and fast. Not all dishes were good, but if you know what to get, you'll have a good meal...."
chinese,Our go to for  dim sum in chinatown. Cheap and quick. Bring a native cantonese speaker with you though because the dim sum cart ladies may not speak...
chinese,"they took over the old joe's shanghai spot.
we came around the time when they first opened.
was very quiet so service was excellent.
the waiter was so..."
chinese,"I know Chinese everything is persona non grata right now, and if the extreme left-wing comments on WaPo and other mainstream news outlets are to be..."
chinese,"This location used to be Joe's Shanghai; it has since moved.  Came here with a friend to checkout the soup dumplings in the new place.

Things your..."
chinese,Ordered from here a few times this one the first time during covid- it was yum! I really enjoyed the Dan dan noodles - in the pictures it looks one they...
chinese,"5 stars all the way! This is probably the best beef noodle soup I had ever had! Broth is super rich pack with a significant amount of flavors, you can taste..."
chinese,Realistically this one for me was a 3 1/2 we had some items that were really great some items that were very underwhelming and we had a bad service...
chinese,"I always like this place
We have gone to it for many years
The service was slow, but the food is excellent 
Maybe if you are patient you will enjoy it more..."
chinese,"Let's set the scene.

We found this place RANDOMLY. When I say randomly I mean like we just walked past it and we're like ""let's try this place"". 

It's..."
chinese,"Worst food I've ever eaten.  I ordered the basics egg foo young, moo shu vegetable and Buddha delight.  Food had no taste and was swimming in oil.  Never..."
chinese,"Tried  this for the first time recently and OMG SO GOOD!
We ordered both the steamed and fried version of the chicken rice and loved both! Will definitely..."
chinese,"This was delicious and so well
Priced. Both the steamed chicken and the fried were great. They only take cash or Venmo, you can find them in LIC next to the..."
chinese,They are located in Long Island city now and have two carts - one at the corner of Jackson Avenue/queens boulevard  and one down the street near the...
chinese,This spot is good for no frills takeout Chinese food. They have an extensive menu and the prices are reasonable for Manhattan. Their wonton soup is one of...
chinese,The best affordable Chinese takeout in the area. The people are kind and it's a great deal.
chinese,This is definitely a solid Chinese takeout restaurant. I've eaten here several times and have not been disappointed yet. Good food and prices. When you want...
chinese,I ordered Atlas Kitchen 2x this last week. The first delivery consisted of the shredded pork with garlic sauce and the mapo tofu. These dishes were...
chinese,Spicy tofu and beef jerky were outstanding- tasty and authentic. Delivery was fast. Excited to try other menu items
chinese,"Delicious, flavorful food. We ordered off the American Chinese menu for kids and had some spicy braised fish and eggplant for ourselves. This was our first..."
chinese,This spot was one of the ones I missed the most during covid because I love their roast meats. Especially their roast pork. When I found out they had...
chinese,"Oohhh yay for roast bbq meats!!!
I've been craving roast duck over rice lunch box!

Came here to grab quick lunchbox to go while shopping in the markets..."
chinese,"Prices jacked up a lot. Congee used to be $4.25 and is now $5.50, wait is forever because half the employees standing around talking. Quality went down as..."
chinese,"This has to be the best kept dim sum secret in NYC.

You know if you walk in and the place is packed with only old Cantonese people that the food is going..."
chinese,"Downtown Yummy (永泰海鲜酒楼; Yongtai Seafood Restaurant, possibly named for the county in Fujian Province, China) is a pretty decent alternative to the slightly..."
chinese,"WHERE THE WILD THINGS ARE...
CHEAP. DELICIOUS. GREAT SERVICE. QUALITY. 
all those words above... altogether...
it's pretty uncommon in Chinatown, but i'm..."
chinese,"I haven't been to the Brooklyn Chinatown on 8th Ave for a long time. After the rally and march earlier today, I came here for dinner with a bunch of people..."
chinese,Corner 28 - The Roast was one of the popular spots in the Sunset Park neighborhood. The Hong Kong style roast BBQ was one of my favorite type of Chinese...
chinese,"This is my go to place for BBQ meats in Brooklyn Chinatown. They have delicious and affordable roast pork, roast duck, roast suckling pig, and roast..."
chinese,"I enjoyed the food. 
I ordered crispy beef which was delicious! 
I have them 4 because it was very noisy so couldn't have much conversation with my friends...."
chinese,Swung by  for restaurant week with friends. They had an amazing deal for restaurant week. Once making it downstairs to the establishment your greeted by a...
chinese,This is the second time I've been to Phillipe and my first time at their location in the Meatpacking District. I've gone to the midtown location before. The...
chinese,"It's not every day that I feel compelled to write a positive review, but Ma La La is absolutely fantastic! It's as if one of my favorite restaurants from..."
chinese,My choice for Chinese delivery in the neighborhood! Their fried rice is the hidden gem here- so good. Always hot and fresh. Never been disappointed.
chinese,Best Chinese food in Astoria. Everything I've had has been fantastic and much higher quality then my old Astoria go-to Chinese delivery spot.
chinese,"Been coming here and its sister restaurant, XO Kitchen around the corner for 20+ years. Food is great and affordable, usually open late pre-pandemic,..."
chinese,"I've neverrr been disappointed by a dish from XO Taste before, and their menu is over 100+ items, so that's a lottt of non-disappointments! Granted, it's..."
chinese,The food is quite fresh and we enjoyed it until the bill came. The lady told us to pay the number on the receipt in cash to save 8% tax which was quite...
chinese,"The hype for the broth is real. My cousin and I had the pork bone broth and it was very flavorful. There were big chunks of pork on bones, tomatoes, and..."
chinese,So for a decent spicy chicken pot and hotpot afterwards this is the place to come. The spicy chicken pot was pretty good for the price. We ordered it medium...
chinese,Unique hot pot base with pricier options. They have very interesting base flavors. We got the HK style chicken pot ($35) which came with a very generous...
chinese,"I'd give them 5 stars if it wasn't for their clumsy, haphazard service. The restaurant actually has a pretty nice feel when it's not crushingly crowded. But..."
chinese,This small restaurant will always be my go to restaurant when I'm craving for a noodle soup. There's always a wait time of 25-35 minutes because the...
chinese,It was raining and there was still a line on a weekend. The shop is not too big but would probably fit 4 or 5 groups of 4. They also have a counter that...
chinese,I happen to love soup dumplings and this place definitely satisfied my craving. Happy to have found them open during this pandemic. Only reason I didn't...
chinese,"Super tasty and authentic. We order delivery and the food is fresh and on time. My partner is a big fan of the smoked pork fried rice, and I love their..."
chinese,"Fast delivery, friendly service, and vegan options! Good place to get a good amount of food too."
chinese,"So yummy and spicy!

I was trying to find the exact spot of the cart around 10pm at night and of course it was empty. Disappointed, I went to get boba at..."
chinese,"At $1.50 for most of the skewers, you really can't go wrong with this place!

Came by for to grab a few skewers as a snack before a late dinner and it..."
chinese,"Some actual Chinese BBQ in Manhattan!
I got two chicken, two lamb and one mushroom. I like the chicken and the mushroom but was not a fan of the lamb - not..."
chinese,"Glad this neighborhood restaurant survived the pandemic as their East Village location remain closed.

Outdoor settings are 6 ft apart and the staff all..."
chinese,"Le Sia is amazing, and I'm so excited they've opened a location in Midtown! They're known for their seafood boils, but I thought the highlight was actually..."
chinese,"Very tasty shrimps and kebabs, especially with garlic sauce. Fresh food. Complex menu, and not everything I thought was on delivery menu, as in the..."
chinese,I've been coming here for over a decade as it's one of my favorites in Chinatown. I haven't been here during lockdown but my favorite dish is probably the...
chinese,"The service here was pretty terrible and the food was just alright.  After shopping around Chinatown, my family of 9 was pretty hungry and we just wanted a..."
chinese,"After shopping for a while, we decided to try out the popular dim-sum place on Mott Street called Royal Seafood but the wait was too much and a large party..."
chinese,"Soooooo after the initial hesitation from my first review, I must say that we LOVE THIS PLACE
This has been our go to for chinese food for delivery (even..."
chinese,"Fast delivery! The food always comes well before the ETA and the food is consistently good - Highly recommend:
Wonton soup
Hot & Sour soup
Shrimp..."
chinese,Our favorite neighborhood Chinese restaurant. We order delivery from A-Jiao every week. They have very authentic Chinese food and they are very fast. We are...
chinese,Came here with my wife during the pandemic shutdown. They had 4 outdoor seats and it was mildly quiet. The staff was very friendly when we were browsing the...
chinese,"We came here during covid, and were promptly seated in a nice outdoor area. The tables were cleaned between customers and had a significant amount of space..."
chinese,"Just ate here with my husband and some friends. Place was kinda empty, but that worked out perfectly fine for us. We had soup, pan fried, and steamed..."
chinese,"The food is great, and it tastes very home-like. I used to order here all the time until they decided to cancel their bento boxes during dinner time. (aNd..."
chinese,"Superior food ! A local place (for me), 25th Street & 3rd Ave. The hours are limited, and they didn't use to deliver, but now they do!"
chinese,"I came here one night when I was desperately craving Chinese food. I have to say, I'm surprised that the rating is lower than 4 stars. I wouldn't say this..."
chinese,"I do like, I really do. The food is great, the service is friendly, and the price is right. I wouldn't think of eating elsewhere."
chinese,I've eaten from here 100000 times. The food is always good and the lady at the front is always pleasant. Unfortunately last night I found a dead roach in my...
chinese,"Always reliable. Hot and sour soup is my barometer for a Chinese restaurant- if that's good, everything is probably good. Theirs is just right. 

Staff is..."
chinese,I've been ordering from this location since it was called Dragon Gate (notice the dragon on the glass at the entrance) and it's always been the best Chinese...
chinese,"My favorite sushi place!
The food is amazing and always fresh.
Crazy tuna roll is so yummy.
So happy to find them 
Highly recommend for everyone!"
chinese,Used to be my favorite place to order takeout from. Boneless spareribs were great and not swimming in half a container of oil. General T chicken was some of...
chinese,"Must try their beef stew, quite special compares to most of the Cantonese restaurants!!!!"
chinese,Legit Cantonese food that's very rare in the neighborhood.  The steamed rice rolls are freshly made with tons of filling.  My favorite was the beef rice...
chinese,Stopped by for a quick lunch. The steamed rice rolls were so good and cheap compared to other places. Freshly prepared per order. Also got their beef stew...
chinese,Was really wanting some Chinese food during the lockdown but every restaurant was closed. Someone posted this one on FB so I gave them a shot. It is certain...
chinese,Our escape from the virus... the place is clean & the food is good. Given the number of Chinese places that have closed this place is consistently good....
chinese,Always amazing food! Glad they are open for delivery during this NY on Pause time. Can't wait til to go there with the family to dine in. Staff is always...
chinese,"Authentic Szechuan is awesome. It's definitely some of the best Szechuan takeout in Brooklyn 

I can't speak to the restaurant itself since we've only..."
chinese,"Really great Szechuan staples. This is our go-to for take-out Chinese. On the regular rotation is the double cooked pork, dry pot chicken, and the string..."
chinese,"My friends and I ordered a veritable feast from Authentic Szechuan, which included all the Sichuanese staples. The menu is not at all exclusively Szechuan..."
chinese,"I've been ordering take out from here as they were one if the only Chinese restaurants open during the past few months. All I can say is wow, the food is..."
chinese,"It's been especially tough finding an open Chinese restaurant during this pandemic. Thankfully, I came across The Best Sichuan on Chowbus as one of the very..."
chinese,My husband and I were thrilled to find a Sichuan restaurant open for pickup and delivery during the COVID-19 crisis. Ordering process was smooth and...
chinese,"Gluten-free American-style Chinese food is hard to find so I was glad to find this place. 

The gluten-free dishes here are reasonably priced and taste just..."
chinese,"Stopped by here after work on a Thursday night for a quick meal. Despite the happy hour, not many people inside the restaurant, so was able to grab a seat..."
chinese,I really liked this place! We (a group of 6 people) were looking for a place to eat yesterday (Christmas Day) and this was the only one open around the...
chinese,"This rating is not so much for the food, which was good regular straight-ahead Chinese food, but for the great service during the coronavirus epidemic.  The..."
chinese,My boyfriend and I ordered here for the first time for pick up. Food was great! I ordered general tso tofu with vegetable fried rice and my boyfriend...
chinese,The best Chinese food in the area. I want to thank them for being the only neighborhood Chinese restaurant open during the coronavirus. New owners but the...
chinese,"Fresh delicious food always ready within 20-25 minutes - glad to see them open again! If you're close enough to pick up, I'd opt for that vs. delivery,..."
chinese,"Their food is amazing! The Pan Fried Pork Dumplings are my absolute favorite, Egg Foo Young, Chow Fun, and Fried Rice are all phenomenal Cantonese mainstays..."
chinese,"Average Chinese. I appreciated how fresh the egg foo young was, however, The fried pork potstickers were too doughy and did not taste fresh. I ended up with..."
chinese,"I'm confused why there are so many negative reviews...
I've been coming here since they opened up for business and it's always been the best. Yes, the..."
chinese,I used to be a fan of this place but the food has gone very down hill. Ordered a takeout yesterday. I ordered beef chow fun and there was literally no beef...
chinese,"Yikes! Where to begin...

If you like rancid food and 1+ hour delivery, then check this place out. After 2 negative experiences here, progressively worse..."
chinese,I will start by saying I have been to Tim Ho Wan in Hong Kong so I was curious to try the location in NYC. I had highly expectations knowing this is a...
chinese,I love Tim Ho Wan! And it didn't disappoint at all! At first I was nervous to try the NYC location since I have had it multiple times in Hong Kong....
chinese,I have been to Tim Ho Wan in Hong Kong and loved it even though it was completely packed and lines were insane. The staff did a great job managing the line....
chinese,"I usually go to this place for noodle breakfast or 3 dishes on rice combo.

The noodles are nice and you can ask for a mix of two.

The lunch combo I..."
chinese,"Don't want to go to Chinatown for your Pineapple or Pork Buns - come here! The buns are 4 stars. 

But the general affair - mediocre. It's basically..."
chinese,"Came here for the lunch special. $7.50 for roast duck, bok choy and tofu over rice. I get that it's fast Chinese food, but everything was so greasy and..."
chinese,"Ordered takeout and excited to get home and try since I was craving mala hot pot. Delicious, fresh, hot and spicy! Very generous portions and they're kind..."
chinese,"Cute, clean little spot w/ wonderful customer service. Not many vegan options on the menu for my hubby who is trying out veganism (yep). It was no problem..."
chinese,"this place is hidden in the streets of sunset park, but I assure you it is a GEM, every time we ordered something from here, we alwalys get greeted in the..."
chinese,I love Lichee Nut and am missing them so much right now in quarantine. I'd kill for some General Tsos Shrimp and Mushu Vegetables right now. I hope they...
chinese,"One of our absolute favorites, and a part of NY history. Docked one star only because it is more American Chinese food than actual Chinese food (what I..."
chinese,Hahaha...silly me. I thought the reviews customers left about the portion sizes were either one-off mistakes or slight exaggerations. Nope. They were all...
chinese,"The only Chinese takeout place I'd order from in my neighborhood. I am so happy They're back open, as they were closed for months because of covid."
chinese,"Very standard Chinese food.  For the area, there are other Chinese food restaurants that are better in quality and taste.  However, if you happen to order..."
chinese,"Unfortunately, I can't give them zero stars. So just letting you know, their chef specials are horrible. For instance, they use chop meat in their chef's..."
chinese,XFF is the spot for affordable and tasty eats in the city. I've been a fan for years and I'm happy to say even though they've expanded over the years the...
chinese,"In my search for best cheap places to eat in NYC, I found Xian and I was curious to know what that ""famous food"" stood for. When I finally got the..."
chinese,They have locations all over NYC. I am upset no one ever mentioned this place to me. How come this Chinese cuisine not available elsewhere. You get the...
chinese,I love this hot pot place! I am surprised with the 3.5 stars as it deserves better recognition. I usually order online these days and usually get the $18.95...
chinese,Before I start my review I want to address the people that leave a bad review because of delivery. People please remember that Grubhub drivers are...
chinese,"The food is good, however I'm really annoyed that the staff already grab a bunch even you specifically said it's only for one person. It ends up $40 just..."
chinese,"This is the best Indian and Indo-Chinese food in New Jersey. As an Indian that's lived in New Jersey for about 4 years, that's pretty much the highest..."
chinese,"Larry Dembrun 
The food was excellent & the service was great. Following all the safety measures nicely. It was my first out door dining experience during..."
chinese,Love love love this place. Have eaten here 3-4 times over the past month (which is a lot for me). Everything we ordered from here has been par excellence....
chinese,"So fresh, perfectly boiled pumpkin, delicious tofu and satisfying meal. I love my custom bowl and the healthy variety of options on the menu"
chinese,"Got the Tom Yum Soup.
Flavor was good (how can one fail) but there was only mushroom and the protein you chose inside, a bit weird."
chinese,This was my first time ordering from here but it definitely won't be the last! I am gluten free and once I started working in the neighborhood I just knew I...
chinese,"Ordered fried fish head noodle soup & nasi lemak. 
Expected the soup to be a little milky like the other places I had but it was plain lol 
The curry was..."
chinese,"Tom yum delicious.
Hainese chicken delicious.

Fair pricing.

They have a condiment tray on all tables. Nice touch. Pre-COVID."
chinese,"I've dined in here before but have recently ordered take out due to covid. As per usual, I'm thrilled with this place. Curry is on point and food taste..."
chinese,Ordered delivery tonight and I must say I'm impressed by this place. Upper Manhattan honestly had been lacking good Chinese in my opinion compared to...
chinese,"Grain House is meant to be slightly elevated  szechuan food, however the plastic utensils and dishes really cheapen the vibe. Service and ambiance were ok...."
chinese,Got the beef noodle soup here for takeout. The service was quick and clean. The dish came with chunky pieces of tender beef simmered in a flavorful broth....
chinese,This is a decent dim sum /Chinese banquet restaurant. Recent renovations are odd (the Jumbotron screens display garish ads while you eat) and the coloring...
chinese,"Disclaimer: this review is strictly related to a recent wedding I attended at Affable Eatery.

My family and I came here this past weekend for the relatives..."
chinese,"This is my go to spot for dim sum with my family in Brooklyn! It's huge inside, but will most definitely get crowded if you don't arrive by 11-11:30am. You..."
chinese,"Service: Delivery 
Quantity: Good
Food: Sushi lunch special $11/ Two rolls lunch special $10.95

Wow! I'm surprised to see this restaurant has such bad..."
chinese,I'm surprised this place doesn't have a higher rating. The Chinese food is great. I have not ordered the sushi. We typically order from here once a week....
chinese,"Great lunch, 
Everything tastes fresh and delicious
The prices are very good
The stuff is friendly"
chinese,"Update: since last post, we have bean coming here every two weeks.   We had the Braised Beef organs $16 , pig ears, fried little fish $10, pig skin with..."
chinese,"I will live and die for Carol's Bun $7 soft shell crab. It's perfectly done, perfectly crisp, umami salt and pepper style and made to order with fried..."
chinese,"Very tiny old space.
I saw people recommend this place for lunch combo or dish to take out.

I got fried  shishamo 炸多春魚 $8 and 豬耳 pig ears $7.5
Both dish..."
chinese,"Truth be told, I was completely unaware of this location until this Labor Day morning. I am so happy that X'ian is open and serving their legendary..."
chinese,"With Xian so close, I am planning to try every item on the menu.  Today we had both the lamb and spinach dumplings both with and without the soup...."
chinese,I've gone to one of the city locations in the past  but this one is nice as well. They are quick and simple as always. They have an outdoor eating area...
