Category,Review
chinese,Classy and affordable - Buddakan is the perfect choice for a date night or just a casual dinner. Since we aren't dining out and are doing take out we...
chinese,"Buddakan was a great experience amid Covid-19. I look forward to returning when indoor dining is available, as the interiors of this restaurant are fabulous..."
chinese,"By far one of my favorite restaurants in NYC. Located in the elegant Meatpacking District, this restaurant compliments the neighborhood with its intricate..."
chinese,"Oh how I missed you New York Chinatown Chinese! Okay, I do not really remember eating any Chinese food in New York, I honestly do not know why I just wrote..."
chinese,"A solid four. I came solely for the xiao long bao (soup dumplings) and they didn't disappoint.

I ordered the dumplings to go (1 order of 8 pork soup..."
chinese,"When you're staying next to a restaurant with almost 7000 reviews, you know it must be special. Truly... that's maybe the most reviews I've EVER seen for a..."
chinese,"*covid-19 experience*

There is always a line at this place. The store is very small and they only allow two customers inside at a time. Take out only +cash..."
chinese,"the Three Treasures Rice (三寶飯) from Wah Fung in New York. Big portions for a great price, very juicy thick cuts of meat. These guys don't skimp on the..."
chinese,"Yelping be in New York City can be a game of disappointment, especially during Covid. The race to the top sometimes mean that the restaurant with five stars..."
chinese,Had to stop by and try these famous dumplings. It was super crowded but the line moved fast and somehow we found a spot to eat (pre-covid time). We got the...
chinese,"One of the rare Chinatown places that aren't just hype and/or americanized. Def affordable, and delicious as well. Can't really go wrong with a meal that..."
chinese,"Everytime I come to NYC and I crave dumplings..... Vanessa's dumplings hits the spot. If you can tolerate spice, the wonton in chili oil is a must! Went..."
chinese,"This place is my go-to for soup dumplings! 

On my Fiancès and I's recent visit, we actually just got engaged, but our renovations fell through for a..."
chinese,I was arguing with someone over which NYC restaurant had the best xiaolongbao (soup dumplings)--my vote was for The Bao/Kung Fu Xiao Long Bao (two sister...
chinese,"First time back since they transformed Mott Street with outdoor dining space (through a city initiative called DineOut NYC). 

Same delicious food with all..."
chinese,"Great frozen dumplings! 

Only had the chance to eat here a few times pre-COVID but 88 Lan Zhou has been my go to place for frozen dumplings for awhile...."
chinese,"Amazing dumplings at a very affordable price, too bad a small family own place like this have to close down permanently because of COVID. The last day is..."
chinese,"I am so sad that this is place is closing, but fear not you are still able to pick up frozen dumplings. It's $16 for 50 of the best dumplings you'll ever..."
chinese,Love this place!! I called ahead to make sure they had indoor seating which they did (since it's getting chilly out.) The workers were really nice and they...
chinese,"So I don't eat pork, and if you don't either (or are vegan/vegetarian), then this place is not for you. All their broths are made with pork. Their solution..."
chinese,Went here last weekend. LOVE THIS PLACE AND LOVE THE PRICE. Typically my go to for hot pot. It's a pretty good deal. What I don't love is the sauce area....
chinese,"This review is for early 2020 (possibly Jan/ feb)

10 piece dumplings for $3.50, peanut butter noodles for cheap and the portion is big enough for a ride..."
chinese,Fast cheap good. Perhaps the most flavorful boiled dumplings you can find in china town. The peanut wheat noodles are a must. Take home dumplings for $.18...
chinese,"I'm glad they do good business wise, but it used to be annoying how many Becky's, Chad's and Stu's would be in here, after going here for over 10 years...."
chinese,"After several months of playing it safe, we get to stop by at one of my favorite comfort food restaurants-- 

From a dozen cooks and a bevy of servers, the..."
chinese,"I did a pandemic pickup last night, I know Nyonya has been around for a long time but last night was the first time I tried their food and I have to say, I..."
chinese,The food here is absolutely delicious and deserves 5/5 but the service is a little slow and inattentive. Regardless of that I would still return and...
chinese,"See, I'm not even remotely cool because it took me THIS long to try Very Fresh Noodles. I have about a dozen Yelp friends who don't even live in New York..."
chinese,"Could not stay away during quarantine and was so happy when they re-opened in June. 

They have updated hours of operations (closed Mon + Tues) and have..."
chinese,Tingly Asian noodles was the ONE thing I craved the most during the pandemic. So happy to see Very Fresh Noodles reopened. I got the tingly beef dry option...
chinese,"5 stars to the restaurant for their customer service! I live outside their delivery range, but they were willing to still deliver my order last night for a..."
chinese,"We stayed in Chinatown during our trip to NYC. While walking around on the first night, we stumbled across Tasty Hand-Pulled Noodles, and I'm so glad we..."
chinese,Maybe the best stir fried noodles I have had. I loved it. Flavorful and the sauce was delicious. The dumplings were so good too! They serve everything in...
chinese,"I'll start off with saying they are following all COVID-19 procedures extremely well. There are plenty of outdoor seatings. If you choose to sit indoor,..."
chinese,"Thrilled they're open again! (Since the pandemic started, been ordering takeout from their sister location.)

Yes, they're priced for the Theater District,..."
chinese,"My husband and I are from Houston, Texas. We were looking for a dinner spot near our hotel. If you are like us, you are browsing these reviews in search of..."
chinese,"Can't believe I never wrote a review! I used to frequent here when I worked in midtown years ago, and this place was always packed during lunch and dinner..."
chinese,"I rarely will do a review based on takeout/delivery, but we've been lucky enough to be in their delivery radius since COVID hit, and have fallen in love..."
chinese,I decided to have takeout this time due to the pandemic but have also went for indoor dining before. This place is awesome and loved it both the times....
chinese,"I came here for a belated birthday dinner with my sister and mom. It was sooo good! First of all, they've created a lot of ambience with their mandated..."
chinese,"After a short walk on the High Line, we came across this restaurant right on 23rd Street.  They have quite a few tables for outdoor dining.

As soon as you..."
chinese,"Really amazing unique gem in Chelsea, with a lively ambiance, filled with Cuban music and the glow of neon lights and low hanging copper lamps. The place is..."
chinese,"One of my favorite spots in NYC. Love Mama, Jeff, Adam, Big John, the whole gang. Take care & be well!"
chinese,"This place is awesome. Came completely sober. Left hammered.  The food is surprisingly incredible. We got the wings, dumplings, scallion pancakes to start...."
chinese,It's the dive bar you never knew you needed. It's loud. It's crowded. But everyone that's here comes back here over and over again. It's not a huge spot but...
chinese,I've been coming here to satisfy my cravings for authentic HK style wonton noodle soup! I haven't been able to see my family due to COVID so I've been...
chinese,"I decided to visit Noodle Village as part of the Send Chinatown Love food crawl (9/1-9/30).

This restaurant offered lots of room for outdoor dining. There..."
chinese,If you' want classic AND authentic Chinese food- look no further! Noodle Village has been a staple of the Chinatown area in Manhattan for ages. I can't...
chinese,"Although we had the 911, the financial crisis on 07, and the COVID-19, this place still shows some class and taste. Yeah, I was sitting on the outdoor patio..."
chinese,Dine outdoor during Covid-19: so the seats are first come first serve and it's nice that it's in the alley and not a lot of people pass by. You order as a...
chinese,"TL;DR version:  Delicious! Especially fun to eat dim sum outdoors on historic Doyers Street, but I miss indoor dim sum dining and having hot tea with my..."
chinese,I'm so glad this restaurant is open during COVID-19. This is one of my favorite spots for a casual dinner and I'm happy to be able to order takeout during...
chinese,"I am updating to 5 stars due solely to two people: GINA AND WILSON. 

Very rarely do two people make me want to come back forever, but someone, Gina and..."
chinese,"Oh Han Dynasty. Or Handy Nasty, if you will. A favorite of mine when I lived in Philly, it didn't take long for me to sample this spot after moving to NYC...."
chinese,"Ever since I got my vegetarian Laksa in Singapore, I've been on a search for the same dish in the New York.

I couldn't believe it when I saw Laksa on the..."
chinese,"Unsure how I haven't written a review for this place yet.  I frequent Buddha Bodai 2-3x/week, so now the servers know me and my order.  I've tried most of..."
chinese,"Hands down the best Asian vegetarian spot in NYC! 

Unfortunately, I can't give a full 5 stars due to some dishes being not so great but other dishes were..."
chinese,they are open for take out during covid. The person taking orders is wearing a mask but you can't really see inside beyond the hanging meats to see if...
chinese,"Even during Covid, their food is the BEST!!!!  It's take out only but it taste the same.  Love this place.  Totally recommend trying this place.  If you are..."
chinese,The service is always quick and the staff is still in good spirit during the coronavirus pandemic. The best part is having Chinese bbq available. If you...
chinese,Hot damn! Any confidence I had about my spice tolerance completely dissipated when the salt and pepper eggplant I got for lunch today absolutely set my...
chinese,"This. Meal. Is. Amazing. My husband and I ordered it for the first time and we'll now be devoted customers for life. The delivery was timely, perfectly and..."
chinese,"I got takeout from this place because I saw its high ratings and I must say it really lived up to the name! Order for 2 people: Wontons in Chili Oil, Dan..."
chinese,We ordered take out for dinner and the food was very tasty. Portions are large which is good as the prices are not cheap. We tried the lomo saltado (one...
chinese,I live around the corner from here and it's always packed for a reason! The menu is exciting and food comes out hot and fresh. Portion sizes are very...
chinese,My favorite location. Grab lunch yesterday with my cousin. It's always delicious and a great time. The food is so filling and the drinks are great. We...
chinese,"Food: 4:5
Stopped by for dinner with a friend. We ordered the crab soup dumpling, the tofu with pork, and the dandan noodles. The crab soup dumpling (3/5)..."
chinese,"Wow wow Bao! We came here knowing we wanted some Asian food, we had zero expectations when we got seated, the service wasn't excellent, but Dear God, the..."
chinese,This is simply the best chinese food that I have every had - by far and away. It would be a tragedy if this placed closed because of Covid. I rode my bike...
chinese,"Tuome really hits the balance between fine dining and straight up delicious food. It's an intimate and cozy space, and the host is really welcoming so you..."
chinese,this is a pre-covid experience review so food only here. i went to Tuome with higher expectations since everything looks amazing on paper. i was quite...
chinese,"They have a small menu but I believe they try to perfect every single dish. However, my experience just totally shut me off.
I ordered chicken liver and..."
chinese,"I've heard so many great things about Xi'an Famous Foods, so we had to give this a try while we were in New York! We found so many locations all around us..."
chinese,The best darn hand-pulled noodles I have ever eaten in my life. Hand-pulled noodles done right is such a rare find. The spicy cumin lamb noodles (dry)...
chinese,"This location is not as convenient for me but it's open! The staff here is friendly and efficient. The dining area is closed off, arrows on the floor for..."
chinese,"We had a big family gathering, and needed a spot to eat dinner. We originally wanted to do take out and eat it at the park or at home, but we saw that they..."
chinese,"It has been a long time wait, but iam glad we were able to stop by and order $80 worth if food.   They all had mask on and was quick in having the food..."
chinese,This place will always be my absolute favorite place to get chow fun. It's a true NY staple and I have been eating here my whole life. It's nice that they...
chinese,"It's Chinese New Year and a group of us are in NYC for the weekend, unfortunately not to sightsee or enjoy the city, but to work the entire weekend for a..."
chinese,"I placed an order during the pandemic, and the pickup was quick and seamless. I also loved the quality of the bag that it came with (emblazoned with the..."
chinese,"The dishes here are btw $5.50-5.95. Def more than typical dim sum dishes. I ordered the Sticky rice with lotus leaf, bean curd roll, chicken feet, har gow,..."
chinese,This is probably one of my favorite noodle spots I've had in a while. This spot seems to be more of a takeout / hidden gem type of spot since although they...
chinese,"got takeout from here, and the quality was amazing! rice noodles were great and something i usually never get, but combined with the pork and tofu, it was..."
chinese,"***Pre-COVID*** When this place opened, I was pretty excited to try out the ~new~ Chinese place down the block, and it did not disappoint! Fair prices for..."
chinese,Happy this restaurant is open during COVID. My Singaporean roommates has been telling me about this place. Went with my mum and sis. There are three seats...
chinese,"*COVID-19 outdoor seating experience*

Came here around 6PM on a Saturday night and didn't have to wait for a seat. All the dishes came out within 15..."
chinese,"Outdoor seating on most of Mott Street, it's the only way Chinatown will survive. Beautiful night out given it was not 90+ degrees on this August evening...."
chinese,"This was my go-to ""comfort food"" spot for both dine-in and delivery when I was living on the UES. After a long day of studying, I would either pop by for a..."
chinese,"Was craving some noodle soup and this place popped up in my searches. 

Now this place is pretty interesting, the marbled pork noodle soup had large chunks..."
chinese,"These guys are legit. Like kung-fu fighting, Shaolin monk legit.

This is not a Japanese ramen shop. They do offer some bowls of JP-style ramen, but if you..."
chinese,Had a great time! They have indoor dining (no outdoor) and they check your temperature at the door as well as get you to sign an information form. Hand...
chinese,"****Pre-COVID****

Always love coming here on a normal day, but especially on a birthday week! Pro tip: come with 3 friends and your meal's on the house...."
chinese,I LOVE HOT POT and they have so much variety. The broth is amazing - I always get the Spicy but the regular broth hits just the same. I miss it now since...
chinese,I came here about a month ago with my sister because we were having our usual malaxiangguo cravings. We've only tried the malaxiangguo in Flushing before so...
chinese,"THIS PLACE IS THE BOMB!!!!! Came here with family on a super freezing cold day (it was so cold I was actually angry) in January while we were visiting, and..."
chinese,"Wow. Such a great restaurant! We got take out from here and it was amazing. The food was still hot when it was delivered, which is always a plus. This was..."
chinese,"Although my initial quick lunch today (rice dishes) was questionable, what I experienced from them next (roasted meat) was ""mwah"" excellent! 

We came to..."
chinese,Been coming here for years. Never left unhappy with their food or serving size. Still visiting during the pandemic to take out.   Hope they survive all this...
chinese,"The cherry on top of boozy nights out on the Lower East Side. Haven't been since the pandemic began, but the food is delightfully greasy and flavorful."
chinese,"Amazing as usual, even during a pandemic. Obviously get the big tray of chicken and don't forget to add noodles.

While there's a tiny table up front, Spicy..."
chinese,Spicy Village is one of my favorite cheap eats in Chinatown and maybe NYC. My most recent visit was during COVID so it was takeout only. The business...
chinese,"Ordered the grilled pepper chicken and tomato and egg noodles from the great recommendation of the Fung Bros!

Picked it up and didn't eat it until at least..."
chinese,"Closed down temporarily. Heard they may not open back up 

By far the best dim sum spot in Brooklyn and Manhattan! 

The food was good quality and the..."
chinese,"This was the last place I ate before the pandemic and I cannot wait until they reopen. Best dim sum in NYC, no contest. Miss you guys!"
chinese,"I miss this place so much! 
I hope they re-open as I will be the first in line. This is the best dim sum place in ALL of Brooklyn. If you want the  real dim..."
chinese,"After Shujiao's closure during Covid I wanted to find Fuzhounese styled dumplings that were on par with their dumplings, cheap and delicious. Super taste's..."
chinese,"Adapted for the COVID climate, Super Taste lives up to its name.  A variety of spicy and savory dishes that made my mouth water.  The price can't be beat,..."
chinese,"(COVID-19 Phase 1 NYC reopening)

Open for takeout. Dry beef noodles are curry sauce. Prices have gone up to the $8 range."
chinese,"Spice Symphony is such a unique combination of flavors, I'm sad I didn't go for the Chinese Indian menu but I am SO glad I stopped in with my friend. It's..."
chinese,I used to come here during work lunch and the meals were not only great but very reasonably priced. You can get a three course individual meal for 10-13...
chinese,"As a Bombay girl, finding niche Indian food to please me is really hard. I've usually frequented Murray ""curry"" Hill joints but went to Spice Symphony for..."
chinese,Wonderful restaurant! Really enjoyed our visit there. Nisaar's (our waiter for the evening) service was beyond excellent. He made us feel extremely welcome...
chinese,"The place is wonderful! Talked to the owner when picking up my food during Covid19, super laid back and welcoming, we got chicken korma and the garlic naan..."
chinese,"We had an excellent dinner at Spice Symphony, sitting in their curbside outdoor space, tables six feet apart. It was very comfortable, like a cozy pavilion...."
chinese,"Chow House has limited service at this time. They are open 3 to 9 pm for takeout and outdoor seating. They used to be open for lunch and dinner, with a..."
chinese,Chow House is my by far my favorite Chinese food in the city!! I always order the broccoli with garlic sauce and the scallion pancakes. I usually order...
chinese,"Every time I feel like not going out I get something from this place, food is fantastic! and the delivery service does not take long to get to your door, it..."
chinese,"We came here couple times and this is definitely one of the best Chinese restaurant in west village. It's real Chinese food, not American Chinese food. 
The..."
chinese,"This is actual Chinese food! It's a little bougie, a little pricey, but the quality is definitely worth the money. I came here for lunch and they have a few..."
chinese,"Food was pretty good. We had the braised pork belly, spicy shrimp wontons, and the chickpea noodles. My favourite was the chickpea noodles. My boyfriend..."
chinese,"Such good noodles! Fresh and chewy. Delicious broth and sauces. We come here 1-2x per week! Amazing, friendly service."
chinese,"Was really looking forward to this place.

My bf liked it a lot, but I did not. We ordered the big chicken plate, lamb skewers, signature Lanzhou beef..."
chinese,This was my second time dining at Dun Huang's location in the East Village and I was just as satisfied with this experience as I was with my first. Even...
chinese,The duck is really tasty and the snacks as well. I would recommend the sets without rice. Since that would be a bit too much.
chinese,"I had dinner here on New Years Eve. The restaurant, located downstairs, was very small with few bar seats and a long communal table. Music and lighting was..."
chinese,"Heard they have awesome Peking duck!
Make sure you book in advance. They only offer certain amount of pecking duck each day. 

It was $79.95 per person.
For..."
chinese,"I ordered a chicken lo mein and shredded pork with bitter melon over rice. First, I have to say the food improved greatly from when I last ate here...."
chinese,"I decided to come to Congee Village as part of the Send a Chinatown Love food crawl (9/1-9/30).

Because of COVID, the restaurant is currently doing outdoor..."
chinese,"I've loved Congee. I use to frequent their old location, up until they closed. It's the perfect place for a large group. My friends and I love it. During..."
chinese,"I really loved this place before COVID: the carts were always fully stocked, there was a great amount of variety.  Their sticky rice was particularly better..."
chinese,"Good dim sum but very limited veggie options. Not on menu-- veggie dumplings, veggie soy sauce noodles. Have to ask the waiter! Most other dumplings have..."
chinese,"Takeout and outdoor dining during our strange covid time.

If you're going, wait until they're in full swing. If you order when they're first open, the food..."
chinese,"Traveling to NYC with a friend at the tail end of the quarantine, my favorite go-to Chinese restaurant has not yet reopened. 
Turning to Yelp, I selected Da..."
chinese,The fish fillet was really good and spicy. Lots of mala spice. Tendons were also thinly spiced and very spicy. I added some lettuce to it to make it more...
chinese,"Ordered scallion pancakes on a whim through Grubhub - everything went smoothly, and the front staff were super nice and prompt! Their scallion pancakes were..."
chinese,"Pleasant neighborhood Chinese noodles, potstickers, xiaolongbao in Chelsea. XLB tastes handmade and juicy. Will come back for other take out or outdoor"
chinese,"The best Chinese food in NYC. Love their Chicken Dumpling soup, great variety of dumpling and pork buns . I used to have their soup at least three days per..."
chinese,Prob's our office's favorite takeout place to order from. It's exactly what you want. Lots of warm and fresh steamed dumplings. Delivered to you very...
chinese,"The noodles were were excellent. It wasn't overly boiled - al dente, even, if you will. I came here for a tinder date and we weren't disappointed. the sauce..."
chinese,"Pre-COVID I would walk by here everyday on my way to and from work, but never made it in for dinner. Came here when I was in the neighborhood for the..."
chinese,"this is a class above a lot of places in this category, got delivery it was really incredible. we ordered a second time through yelp soon after and they..."
chinese,Easily in my top 5 faves of NYC as a vegetarian. I've come here a bajillion times with vegetarians/vegans and meat-eaters alike and NOBODY has left...
chinese,"I'm obsessed with the vegan appetizer platter from Bodhi. It includes char siu ""meat"", some other ""meat"" dishes and jelly fish, all made from soy protein or..."
chinese,When my wife and I went vegan almost 5 years ago I thought dim sum was something I would have to consign to the fond memories of the past. But When we went...
chinese,"PRO TIP - CASH ONLY!!

You literally cannot get better Hainese Chicken in NYC other than this place! It's the only thing they sell and there's a reason why..."
chinese,"Hands down the best Hainanese chicken over rice I've had. 

I've had this place bookmarked for a while now and I finally had the chance to try it out. I..."
chinese,"Hands down, BEST Hainanese chicken / Khao mun kai eatery in the States. 

You know it's gonna be good when a restaurant serves just one dish. The guy who..."
chinese,So glad they finally reopened! We almost ordered the entire menu. Was worried the noodles wouldn't travel well with takeout but the consistency was still...
chinese,"This is for xi'an home kit through goldbelly. We are in a pandemic, I can't travel to nyc so I thought I'd ordered a piece of nyc to Texas. The home kit..."
chinese,"Delicious even as take-out. Glad it's back for take-out. I thought it would be soggy, but noodles were good. I got this in mild and it had just the right..."
chinese,"A great spot to have a small dinner or drinks. They have a large amount of seats outdoors so finding a place to sit won't be a problem. 

Drinks - got the..."
chinese,"Who does it better than Macao?! The food here is top notch (some of the best in the city, in my opinion), the drinks are spectacular, the staff is kind and..."
chinese,Oh my God I had so much fun when they were open before the pandemic hit! Dumplings and the burger are my to go-to. Music and drinks. Food. Crowd. I hope...
chinese,"No expenses were spared to create as close of an ""indoor SMH experience"" as possible outside; they even play music and have incense to mask the unpleasant..."
chinese,I was always told by my friends that this was the place to go and have never visited until today. We went to this restaurant on a Saturday and to my...
chinese,"Kudos for Szechuan Mountain House for individually packing EVERYTHING during these COVID times!  When we were seated we had a bag with chopsticks, a spoon,..."
