Category,Review
japanese,"I've ordered from this place 3 times already in the last few days, they are GREAT! I had a hard time finding good/fresh sushi during the pandemic and..."
japanese,"Food was made very quickly and absolutely delicious. Would 100% recommend. Gave me a box of pineapple with my order, very kind of them."
japanese,This spot is near where I live and while working from home I wanted sushi for lunch.  I ordered the 3 Maki Roll Lunch Special and chose the Tuna Avocado...
japanese,This review is for delivery via Caviar in August 2020.  I had a sudden + unbearable sushi craving and we ordered kaisen chirashi and another dish that was...
japanese,"This is a review of the take-out and delivery service during July 2020. As of the date of this review, Hirohisa offers take-out and delivery of its..."
japanese,Dine at this restaurant for dinner pre-lockdown and had the tasting menu. Super attentive service and delicious food. The restaurant is not very big and is...
japanese,"Had the most sensational meal at the Peruvian Japanse fusion restaurant @sensakay.
 Morala
-Torched Salmon Ceviche 
-Japanese Snapper Tiradito 
with the..."
japanese,Came here for Christmas Eve dinner without a reservation and was seated right away. Conveniently located close to grand central station and lots of seating...
japanese,"Good, but not great -- the definition of a 3.5 star review in my opinion, which is what i would have given here if i could. But had to choose between 3 and..."
japanese,"I've been a regular here since it opened (which is a great addition to the block). Before Covid, this place would get packed with students and kids since..."
japanese,Love the rice balls!! Used to get lunch here all the time. During the pandemic they're doing pickup through ritual. Very fast and easy
japanese,"Today was my first time ordering from Yaya Tea Garden.

I purchased a large Japanese riceball, a large Yaya Chicken riceball, and a small Spicy Crawfish..."
japanese,We found this place on Yelp and it delivered! Their outdoor seating situation is top notch. The sushi rolls were good as was the sake. Pro tip: look at both...
japanese,I've been coming to this place for a while now and it's always been a decent spot for sushi! Whenever I don't know where to go to get sushi I go here- it's...
japanese,"For a regular go-to sushi restaurant, this place is absolutely amazing. I'm an omakase girl, but those meals are not everyday meals and Marumi here really..."
japanese,"My manager took me here to celebrate getting lots of work done after a heavy week (woohoo!). Oh my, did I get HOOKED on their happy hour!
(FYI Hama Happy..."
japanese,We were in the area for a show and decided we wanted sushi. We found Hama on yelp and decided to try it as it had the best ratings in the area. We walked in...
japanese,"Came here around 6:15pm on Friday and didn't wait to be  seated. The restaurant is located underground, not packed but there were plenty of customers. We..."
japanese,"Went to Shuko Saturday night and would rate the place 4.5 stars. Even with our reservation, we had to wait a little downstairs by the bathroom. The staff..."
japanese,My husband and I came here the night before a vacation a few months ago and we had a lovely time sitting at the counter.  We were able to get a reservation...
japanese,The ambiance here is uniquely hip - 90s/early 2000s hip hop classics bump through the speakers while the sushi chefs at the bar don Yankee hats instead of...
japanese,"One of my favorite spots to eat after work. Always eat here with my boyfriend. I love the ramen with sushi meal, great deal!  I hope this place will be okay..."
japanese,"I really really love this spot. It was closed for a while during the quarantine but they are back. The food is simple, clean and of great quality. The ramen..."
japanese,"This is one of the rare sushi places that are actually run by friendly Japanese people. 

There is inside and outside dining, and hand sanitizer by the..."
japanese,"Value 4/5
Taste 4/5
Service 4/5
Presentation of food 5/5
Appearance of the establishment 4/5"
japanese,"My favorite Tacoyaki spot!

Japanese Street food at its finest! I'm a little disappointed in the lowered review but you can't satisfy them all! I have been..."
japanese,"Pork Okonomiyaki: OK, not bad
Takoyaki: Pretty good, great sauce
Service: Bad
Speed: Very slow
Sitting area: sits 5

Not really impressed by this place. The..."
japanese,"As a nurse that is fighting in front line due to COVID, best way to get appreciated is by good food! Thank you Zuma for the free food you gave me at Four..."
japanese,The restaurant was nicely decorated and had a lovely interior. There are two floors and a private section which is great for company events. The service was...
japanese,"In the realm of Japanese food, it is the unparalleled attention to detail of the flavors, the meticulously monitored quality of ingredients and freshness of..."
japanese,Ordered from seamless and my chopsticks came covered in mold. Anyway the food was good. Just be careful about takeout.
japanese,"This place was absolutely fantastic. Starting with the quality and freshness of the fish and ending with the service. 

We came with a party of 6. We..."
japanese,"This was a really solid sushi spot. Came in on a weekday following a nearby meeting not really expecting much. 

Huge menu, but wasn't super hungry so went..."
japanese,The ramen here is hands down the best I've ever had! I've tried other ramen spots and they don't compare. The broth they use is so flavorful and the meat is...
japanese,I went here with my boyfriend after we both got off work. This was before the pandemic but oh my god it was delicious! He got the spicy ramen which would've...
japanese,"One of very first wave of disruptive IEKEI(家系) style ramen, originated from Yokohama, Japan. 
IEKEI style has been now a main stream in Japan for over a..."
japanese,"One of my favorite places in Williamsburg! They are open for take out and now have outdoor seating that is very well spaced, with a covering overhead for..."
japanese,"I ate here last year on labor day weekend (2019) on a whim....my boyfriend and I skimmed the menu and thought it sounded good, and it was close to our..."
japanese,Woww. This place is small but flavorful. I was intrigued by the Ginanjuice because it sounds you guessed it just like a juice but with gin. It's actually...
japanese,"Cute little Japanese market in Soho. They're stocked with all the usual trappings of a convenience store, with the additional benefit of serving hot food to..."
japanese,I've been visiting this place for any kind of shopping for more than a decade but yesterday got me so disappointed that they did a very unacceptable mistake...
japanese,"I know when you are in a big city, finding certain items especially ingredients as well as some specialty foods is hard to find. If you are looking for..."
japanese,The sushi here is excellent. The best part is the specialty  and seasonal rolls. It's super creative and delicious. My favorite dishes here are the spider...
japanese,"We love Yamato and we are so glad they are back! Their contactless pickup was extremely well-done- they have a plexiglass wall with a box, they place your..."
japanese,"It's a very small restaurant, right Near Starbucks. We drove here looking and craving for some fresh sushi. We saw on yelp that they had great rating so we..."
japanese,"I was thinking of ramen takeout initially, then Tsurutontan showed up on my option...well, how about curry udon?

Yes, they do have it!  The decision was..."
japanese,I've been to this restaurant in their Boston location so once in NYC I knew I had to go here! The udon was delicious and my Truffle udon with crab and creme...
japanese,"Pretty damn good. I've been here twice and ordered delivery once. I wish I could remember what it was I ordered, but it was delicious. One of the dishes was..."
japanese,I love this place! The food is amazing and the people that work there are so nice. I wanted some food for a small socially distanced rooftop gathering and...
japanese,"I came here with my girl and a Pulsd deal that allowed us 2 starters, 2 ramens, a dessert to share and a bottle of wine or 2 carafes of their house sake. We..."
japanese,"We came here because of a PULSD deal and thought it would be interesting to try. 

Pros:
Jack's sliders was the best 
salmon sliders were also very good..."
japanese,"Nice severs, good patio, good food  I highly recommend this place. We got Tantan Udon and Braised Pork. It was very good plus the social distancing is not..."
japanese,I had the pleasure of eating here last year and again as takeout. Both experiences were great. The hours have changed to accommodate a takeout schedule....
japanese,I'm like a million delivery reviews behind given the corona thing. But I thought I'd write this one now so that everyone can take advantage. We had hanon...
japanese,Sushi Zo is an icon. I have been to the LA location but never NYC. I am so glad a found a reservation and decided to try this place. Every bite was...
japanese,"This cozy sushi den tucked in the middle of Greenwich Village was a great meal. 

We started off with bubbles and moved onto sake. 

Omakase was a series of..."
japanese,"Food: 5/5 (for fish quality, rice, and preparation)
Service: 5/5 
Ambiance: 5/5

I always come back because I know I won't be disappointed. Sushi here leans..."
japanese,"Covid-19 dining out experience: there is a pretty sizeable section of outdoor seating set up on  this entire street, with restaurants cordoning off about..."
japanese,Ordered delivery couple of times. They also have nice outdoor seating area. I like the Chicken nanban which is crispy and with special sour source and...
japanese,"COVID takeout review: this place is the real deal, wish I had taken pictures of the food. The ""Triple Don"" was only $22 but had GIANT pieces of high quality..."
japanese,This place is the best ramen/pork buns I've had in NYC! They package up everything for takeout very well. The Kara miso is my favorite-it's very spicy and...
japanese,"Tamashii Ramen is open during the pandemic!! I was craving Japanese food and boy was I satisfied! They are on multiple platforms (Uber Eats, GrubHub,..."
japanese,Ordered the kara miso ramen a few months into quarantine and really liked it! Broth was full of flavor and they provided the broth separate from the...
japanese,Tempura here is an art and the whole dining experience was a mindful meditation in quality ingredients.  Missing them during covid times!
japanese,Wonderful lunch on a Saturday afternoon. We chose to sit outside. The tables are well spaced.  A bottle of hand sanitizer was put on our table when we were...
japanese,"The experience was unique and for that, my interest has been sustained.  Tempura dishes were ones that I had some, but not total exposure, when I visited..."
japanese,Really missing this place right now. I came here all the time pre covid when my hubby and I craved for a hearty bowl of ramen. I always ask for extra...
japanese,I went yesterday with my friend and the ramen in this place is good. I had the tabata ramen. A list of things that I fell for the chicken was cook perfectly...
japanese,Chicken ramen is okay - has a creamy coconut broth not found at most other ramen places. Don't get the pork garlic ramen - it's way too garlicy and the pork...
japanese,"The obvious downside of finishing the most exquisite sushi you've ever had: ""Now, how can I be satisfied with any other sushi for at least the next year....."
japanese,Came here for a Valentine's Day dinner last year - the food is amazing and the service is perfect. The chef came out to great everyone as well which was so...
japanese,"This might well be the best sushi meal I have EVER had in the world, including Tokyo.  It is decidedly a trust fund baby / corporate Amex sorta place:  it..."
japanese,Excellent quality sushi and sashimi and the Black Cod appetizer is also amazing. This is my go-to spot and I will drive there for take out because I'm just...
japanese,"The sushi there are fresh, good portion at a reasonable price. Love this place and will definitely go back!"
japanese,"Great local spot for good quality sushi. I got the regular sushi deluxe dinner which comes with 8 pieces of sushi, a tuna roll and a soup/salad for $27...."
japanese,"Second time I've been here, both pre-pandemic and now post-pandemic! I still love it. Soba Azuma sits nicely in a row of different Japanese specialties..."
japanese,Love it! The Azuma Gozen platter was great since it has the most variety (and the tempura was AMAZING). I recommend that you dine in person since the soba...
japanese,Really liked the food. It was satisfying but didn't make me feel bloated. Excellent service during the pandemic.
japanese,My favorite sushi in the area. Hasaki serves high quality fish at a great price. I'm happy they reopened with a few outdoor tables as well as tables in...
japanese,How this place is not getting 5 Stars eludes me. It's the best kept sushi secret in NYC. The fatty tuna was insane!!! In the best way!!!  Even the wasabi is...
japanese,"Not the best sushi I've had in the city, but it gets the job done.  The restaurant is located below street level and would be easy to miss in the dark if it..."
japanese,"This place was fire. Best tempora roll I've ever had, it was not soggy but actually hot and crunchy. Very decently priced and fresh fish. There are only two..."
japanese,LOVE this place! We were regulars before Covid and still are going strong with them during! I regularly order their lunch bento boxes during the week- such...
japanese,I've been coming here for years and didn't realize that I never gave them a review -- I've literally tried everything on the menu and I've never had a bad...
japanese,"We made a reservation for Saturday brunch at this place. I've only been here once before the quarantine, but my friends went here a couple times before and..."
japanese,"I've dined in once before and because I enjoyed their food (hot pot with short rib, salmon ikura crispy rice), they were on my top list of restaurants..."
japanese,"+ affordable for NY standards (can easily get 1 entree for $13-$15 which is lower priced for Manhattan) 
+ all of the brunch menu items are things I would..."
japanese,"My friends recommended Ichi Umi as the best sushi buffet in town, and I visited for a dinner with my family but thought it was alright. The wait for a table..."
japanese,This place is actually closed! Made a reservation online and it was confirmed. I live in New Jersey btw so we traveled all the way over and it was closed....
japanese,"This place was pending a new grade for a while, and looked today and THIS PLACE IS STILL RATED ""C"" in health grade by the health department. This place..."
japanese,Come back soon Poke! I miss you guys so so much! Hoping they start offering delivery and takeout again soon. Can't wait to support my favorite sushi spot
japanese,"I ordered for delivery during Covid. 
The food arrived in 30 minutes which was good. 

Pros:
-good quality, nothing tasted ""fishy"" 
-fast delivery..."
japanese,"This is not the same place it used to be years ago.
They serve mashed fish, not pieces.
Moreover, portions are outrageously small."
japanese,"TLDR: Excellent high-end sushi bar. Impeccable service, Chef Kousaka will deliver you a tasting menu that you will remember and be yearning to come back for..."
japanese,"Kosaka has all the makings of a stunning, sophisticated omakase restaurant - and indeed, they have one Michelin star. The staff was perfectly friendly and..."
japanese,"Kosaka is an upscale, one michelin star sushi bar located in the west village. The restaurant presents an intimate, dimly lit ambience with soft curtains..."
japanese,"It is the best Japanese restaurant in the neighborhood.  Thankfully, they still open these few months while other restaurants closed.  Fast delivery and..."
japanese,"We love Wasan! Best sushi, good ramen, enjoy the side dishes. Fast delivery as well. Overall good service for outdoor dining, too."
japanese,"An excellent spot for sophisticated and delicious  ramen, sushi, and more, with a special sake menu. My vegetarian family loves the vegetable ramen,..."
japanese,Can't believe it's taken close to 5-7 visits here before finally writing a review. One of my absolute favorite restaurants in NYC. During pre-pandemic...
japanese,"Great for everyday lunch specials for pickup or delivery.

They have several under $10 options to mix and match.  Or $12-$15 set lunch teishoku options if..."
japanese,My Japanese friend invited me here to try what he described as Japanese style tapas. In terms of Covid precautions this place is doing a great job! They...
japanese,"The barrier to entry to enjoy omakase at the likes of Masa, where dinner for 2 (pre-pandemic) would set you back over $1,300 is prohibitively high. Even..."
japanese,"On a Tuesday, somewhat craving tacos and sushi at the same time, I decided to order through Caviar some Nami Nori. And it was the best day of September yet..."
japanese,"This is a review for take-out during the pandemic.

I've heard great things about Nami Nori ever since it opened, so my friends and I finally decided to..."
japanese,"Unrelated to this place, I got Steven A's order and I'm Steven S so I had to get refunded and then reorder. Glad I did. Fast service and pretty yummy food...."
japanese,Unbelievable. This take-out omakase box was some of the best sushi I've ever had. Wow
japanese,"Ordered a zuke tuna roll and a salmon special roll for pick up. Food was ready in about 15 minutes and they called me to let me know it was ready, which was..."
japanese,"Adding this to my list of favorite take out sushi spots.

Very quick with putting together their orders (check)
Fresh fish (check)
Great pricing..."
japanese,"My favorite takeout place in the East Village! Ordered here weekly before the quarantine, and was so happy to see that they're back!
The rolls are good..."
japanese,"I ordered the tricolor sushi dinner and garden salad for take out. The sushi was super fresh and delicate, melts in your mouth. Garden salad was super..."
japanese,"This place is so underrated. Clearly none of y'all 1-starers have tried the soy garlic wings. 

Plus the takeout arrives so quickly. Great kimchi too!"
japanese,"Best Korean fried chicken wings in BK! I missed ktown a ton when I moved out of the area but no longer now that I've found this spot! Great food, lots of..."
japanese,"Ssam was fine but nothing special in my book.  We tried the seafood pancake: tasty but a bit greasy, and two different bibimbap.  I had the short rib - the..."
japanese,This year has been quite the year with the pandemic. I chose my birthday meal this year to be Sushi Daizen. We usually go out for omakase as celebration but...
japanese,"I love sushi - especially their sushi - so authentic and delicious, but my family does not. So I ordered a sushi to go for the first time. It was so good..."
japanese,They're back open for delivery and pickup! Better than I remember. Quality is just as good if not better. Uni was better than when I had it in the...
japanese,Delicious high quality sushi that came when it was expected! Delivery sushi is always a gamble but this place is a real gem!
japanese,"My roommate and I ordered the sushi deluxe, shishito peppers, and a bottle of the plum wine for delivery. This is the one of the few places I can find with..."
japanese,"I ordered from this restaurant yesterday for the first time. I ordered the following rolls: spicy scallop, spicy tuna, shrimp tempura, salmon avocado and..."
japanese,"Awesome lunch special, 3 rolls for $12.50. I appreciate that they put some quality produce in the salad that comes with the lunch special. 

The quality..."
japanese,"Updating my review since ordering more and different menu items. You can see, smell and taste how notably fresh their ingredients are compared to other..."
japanese,"So sad that this place has not been open during COVID, but withdrawal reminded me of the many delicious meals I have had at Amura!  

This is my go-to sushi..."
japanese,"Hands down one of the best meals Ive had in 2020... and its not many because.. you know.. the pandemic.

My good and dear friend took me here for my bday..."
japanese,"Outdoor seating -
Selected counter was not available during the COVID, so we tried 10 pieces Omakase course and all the seafood appetizers plus a few extra..."
japanese,"What an amazing experience with truly incredible service from the waitress and chefs. 

You definitely get your money's worth here - $100 for 14 dishes at..."
japanese,I frequented this amazing place pre-covid. Was missing it so I decided to order in. I just can't describe how impressed I am with how delicious the food...
japanese,"Chicken karaage done right! Crispy, juicy, and meaty! The spicy mayo tobiko sauce compliments the chicken karaage so well. Seriously fried chicken done..."
japanese,Very tasty ramen. Excellent customer service! Definitely get the spicy gyukotsu miso or veggie miso (but ask for noodles instead of rice).
japanese,"Yama is back, and just as good as before the pandemic!  Yelp should stop reporting this place as closed - they're definitely open now.  I've been coming..."
japanese,"Great reliable sushi for pickup! Love the salmon scallion specialty roll, so fresh and tasty!"
japanese,"My go-to sushi spot in the city. Always fresh, incredibly generous serving sizes, and you just can't beat the value. Will always recommend."
japanese,"A co-worker told me the Poké here was great with fair prices so I wanted to try it.
I ordered the large size. You get a choice of three proteins and all..."
japanese,"Coming from LA, my poke expectations and standards are extremely high. I am excited to say this place delivers. I ordered for delivery and everything was..."
japanese,"Recently tried Poke Inn during covid and it was amazing! Fish was fresh, great portion and quick service. Highly recommend!"
japanese,"So, I've only ever ordered delivery from this spot but I feel like that makes a review that much more valuable. 

Some people look for a local bar or pub or..."
japanese,"My daughter and my husband had a field day when they stopped in here for lunch during her 2019 Christmas vacation. Back then, hubs got his usual sushi rolls..."
japanese,I'm sad I found this spot. Because I have probably spent over $2k in sushi from here since the beginning of Covid. I am addicted to the sushi here. I will...
japanese,"Fittingly situated on the border of Chasidic Williamsburg, Shalom Japan makes a valiant effort to pair two unlikely cuisines. Despite neither being..."
japanese,When I heard about a Jewish/Japanese fusion restaurant with great reviews I knew I absolutely had to try it! I came with my boyfriend on a Saturday evening...
japanese,"Came here to celebrate bf birthday!
Party of 13 fits
A bit crowded though


Favorites: toro toast, the mezeman meat in the noodles so creamy tasty. The..."
japanese,Love this place. Excellent and inexpensive salmon yummy stick. Love the owner who is the nicest man in the entire world.
japanese,Spot is a gem. Never heard of it before (don't live in the area) but was swayed while walking past based solely on the good vibe of his tiny setup. Been...
japanese,"Solid eats for someone like me who grew up on the ubiquitous Kimbap rolls. Creatively they took it to the next step, it's really a burrito If you don't cut..."
japanese,I struggle with my reviews during this covid-time and definitely am a bit more relaxed about giving a 5 star rating than normal. I would say Douska sits...
japanese,"My boyfriend and I are big fans of this restaurant! Precovid, we loved coming in late to grab a few supper hand rolls and the food always hit the spot...."
japanese,"Nice outdoor dining experience with friends during this time. The hand roll was very satisfying- must try: Hokkaido scallop, Negi toro and uni. I haven't..."
japanese,Amazing as always. Fresh fish. Good selection of items. Service a little slow & delayed and out table was weirdly in a corner. But other than that will come...
japanese,BEST FIDI EXPERIENCE. There are restaurants and there are dining experiences. This is a fabulous experience from the reservation to the check. The hostess...
japanese,"Ordered again, this time I got the Nobu bento and it was really tasty. They were very generous with the portions for my order compared to what the photos..."
japanese,"Ordered for pickup last night and it was probably the best sushi takeout I've ever had.

I got the 10 piece omakase, which comes with a cut crab roll as..."
japanese,"Ordered omakase for pickup and it was absolutely delicious. The rice was still warm, fish was perfectly fresh. I was so impressed! Highly recommend!"
japanese,Simply extraordinary. Every attention to detail and freshness that could be taken was taken. Service flawless.
japanese,"Wish I had photos of the food to share, but after a few beers the food kept disappearing before we remembered to take pictures.

Great selection of Japanese..."
japanese,"Really enjoyed our visit today. Nice outdoor tent and booth tables. Excellent covid precautions. Tapas-like portions, all very reasonably priced and..."
japanese,"Simply put, when I eat here I feel happy. The food is fantastic, the service is warm and attentive, and the prices are always surprisingly decent for what..."
japanese,"Great lunch special deal - katsu, rice, tuna rolls and miso soup all for $13.50! Will definitely be back to try their other lunch combos."
japanese,Meeeehhh. Stopped in here for an early dinner after the Museum of Natural History. Was craving just a few pieces of sushi and that's what I ordered. No one...
japanese,"I know there are a lot of places in town with sushi-washing. But when I sat down at this place and heard that the other customers around me speak Japanese,..."
